{
  "$schema": "https://json-schema.org/draft/2020-12/schema",
  "$id": "https://github.com/techbeansjp-free/AGENTS.md/schemas/project-policy-v0.3.1.json",
  "title": "agent-skill-chain risk比例型project policy",
  "type": "object",
  "additionalProperties": false,
  "required": ["schemaVersion", "delivery", "merge"],
  "properties": {
    "schemaVersion": {
      "enum": [
        "agent-skill-chain/project-policy/v0.3.0",
        "agent-skill-chain/project-policy/v0.4.4"
      ]
    },
    "delivery": {
      "type": "object",
      "additionalProperties": false,
      "required": ["stopAt"],
      "properties": { "stopAt": { "const": "pull_request" } }
    },
    "issueProject": {
      "type": "object",
      "additionalProperties": false,
      "required": ["owner", "number", "statusField", "startedStatus"],
      "properties": {
        "owner": {
          "type": "string",
          "pattern": "^(?=\\S(?:.*\\S)?$)[^\\p{Cc}\\p{Cf}]+$"
        },
        "number": { "type": "integer", "minimum": 1 },
        "statusField": {
          "type": "string",
          "pattern": "^(?=\\S(?:.*\\S)?$)[^\\p{Cc}\\p{Cf}]+$"
        },
        "startedStatus": {
          "type": "string",
          "pattern": "^(?=\\S(?:.*\\S)?$)[^\\p{Cc}\\p{Cf}]+$"
        }
      }
    },
    "merge": {
      "type": "object",
      "additionalProperties": false,
      "required": [
        "mode",
        "branches",
        "methods",
        "requiredChecks",
        "requiredReviews"
      ],
      "properties": {
        "mode": { "enum": ["disabled", "assisted", "automatic"] },
        "branches": {
          "description": "3つの役割を兼ねる。1) head allowlist。PRのhead branch名を * をワイルドカードとして照合し、一致しないmergeを拒否する。主用途であり worktree.allowedBranchTypes と揃える。2) 長命branchペアの判定。baseとheadの双方が完全一致するとき長命branch間のmergeとして扱う。3) 長命branch警告のbase候補。ワイルドカードを含む要素はbaseにならないため候補から外れ、残りが2件以上のときだけ長命branch間のsquash/rebaseに対する警告が発火する。",
          "type": "array",
          "items": { "type": "string", "minLength": 1 },
          "maxItems": 32,
          "uniqueItems": true
        },
        "methods": {
          "type": "array",
          "items": { "enum": ["merge", "squash", "rebase"] },
          "uniqueItems": true
        },
        "requiredChecks": {
          "type": "array",
          "items": { "type": "string", "minLength": 1 },
          "uniqueItems": true
        },
        "requiredReviews": { "type": "integer", "minimum": 0, "maximum": 20 },
        "reviewIndependence": {
          "description": "reviewの独立性の要求水準。context-isolatedはimplementerと別session/contextを要求し同一actorでも成立する。actor-independentはPR authorおよびimplementation commit authorと別のstable actor IDを要求する。未宣言の既定はcontext-isolatedである",
          "enum": ["context-isolated", "actor-independent"]
        }
      }
    },
    "budgets": {
      "type": "object",
      "additionalProperties": false,
      "required": ["localFeedbackMs", "prGateMs"],
      "properties": {
        "localFeedbackMs": { "type": "integer", "minimum": 1 },
        "prGateMs": { "type": "integer", "minimum": 1 }
      }
    },
    "rules": {
      "type": "array",
      "items": { "$ref": "#/$defs/rule" }
    },
    "staging": {
      "type": "object",
      "additionalProperties": false,
      "properties": {
        "root": {
          "type": "string",
          "pattern": "^(?!/)(?:(?!\\.{1,2}/)(?:\\*|[^/*\\\\\\p{Cc}\\p{Cf}]+)/){0,15}(?!\\.{1,2}$)[^/*\\\\\\p{Cc}\\p{Cf}]+$"
        },
        "tracked": { "type": "boolean" },
        "issueBody": { "enum": ["full", "pointer"] }
      },
      "if": {
        "required": ["issueBody"],
        "properties": { "issueBody": { "const": "pointer" } }
      },
      "then": {
        "required": ["root", "tracked"],
        "properties": { "tracked": { "const": true } }
      }
    },
    "worktree": {
      "type": "object",
      "additionalProperties": false,
      "required": [
        "root",
        "namePattern",
        "branchPattern",
        "allowedBranchTypes",
        "base",
        "cleanup"
      ],
      "properties": {
        "root": { "const": ".worktrees" },
        "namePattern": { "const": "{timestamp}-{issueNumber}-{slug}" },
        "branchPattern": { "const": "{type}/{issueNumber}-{slug}" },
        "allowedBranchTypes": {
          "type": "array",
          "minItems": 1,
          "maxItems": 32,
          "uniqueItems": true,
          "items": {
            "type": "string",
            "pattern": "^[a-z][a-z0-9-]{0,31}$"
          }
        },
        "base": { "const": "remote-default-branch" },
        "cleanup": { "const": "after-merge" },
        "finalizeIgnoredPathAllowlist": {
          "type": "array",
          "maxItems": 64,
          "uniqueItems": true,
          "items": {
            "type": "string",
            "pattern": "^(?!/)(?!.*(?:^|/)\\.(?:/|$))(?!.*(?:^|/)\\.\\.(?:/|$))(?!.*(?:^|/)\\.git(?:/|$))(?!\\*\\*/(?:[\\p{L}\\p{N}._-]*\\*(?:\\.|\\.\\.|\\.git)|(?:\\.|\\.\\.|\\.git)\\*[\\p{L}\\p{N}._-]*)$)(?:(?:[\\p{L}\\p{N}._-]+/)+|\\*\\*/[\\p{L}\\p{N}._-]+/|\\*\\*/(?=[\\p{L}\\p{N}._*-]*[\\p{L}\\p{N}._-])(?![^/]*\\*[^/]*\\*)[\\p{L}\\p{N}._-]*\\*?[\\p{L}\\p{N}._-]*)$"
          }
        }
      }
    },
    "projectChoices": { "$ref": "#/$defs/projectChoices" },
    "projectRuleRetirementProposals": {
      "type": "array",
      "description": "trusted側へ先行登録するproject rule廃止提案。rule IDとtrusted fragmentのraw UTF-8 SHA-256が一致する完全削除だけを後続PRで受理する。",
      "maxItems": 16,
      "uniqueItems": true,
      "items": {
        "type": "object",
        "additionalProperties": false,
        "required": ["ruleId", "beforeSha256", "reason", "owner"],
        "properties": {
          "ruleId": { "type": "string", "pattern": "^ASC-[A-Z0-9-]+$" },
          "beforeSha256": { "type": "string", "pattern": "^[a-f0-9]{64}$" },
          "reason": {
            "type": "string",
            "pattern": "^(?=.*\\S)[^\\p{Cc}\\p{Cf}]+$",
            "description": "制御文字を含まない非空の廃止理由"
          },
          "owner": {
            "type": "string",
            "pattern": "^(?=.*\\S)[^\\p{Cc}\\p{Cf}]+$",
            "description": "制御文字を含まない非空のowner。認証の根拠にはしない"
          }
        }
      }
    },
    "projectChoiceShrinkProposals": {
      "type": "array",
      "description": "利用側project ownerが既定branch側へ事前登録する縮小提案。次のPRでこの宣言とchoices fragment fileのraw byteが一致する縮小だけを受理する。候補側へ登録した提案は受理判断に使わない。",
      "uniqueItems": true,
      "maxItems": 16,
      "items": {
        "type": "object",
        "additionalProperties": false,
        "required": ["fieldPath", "afterSha256", "reason", "owner"],
        "properties": {
          "fieldPath": {
            "enum": [
              "projectChoices.testLayers",
              "projectChoices.forbiddenTestFileSuffixes",
              "projectChoices.quality.forbiddenTypes"
            ]
          },
          "afterSha256": { "type": "string", "pattern": "^[a-f0-9]{64}$" },
          "reason": { "type": "string", "pattern": "\\S" },
          "owner": { "type": "string", "pattern": "\\S" }
        }
      }
    }
  },
  "allOf": [
    {
      "if": {
        "properties": {
          "schemaVersion": {
            "const": "agent-skill-chain/project-policy/v0.4.4"
          }
        }
      },
      "then": { "required": ["budgets", "rules"] },
      "else": {
        "not": {
          "anyOf": [
            { "required": ["budgets"] },
            { "required": ["rules"] },
            { "required": ["worktree"] },
            { "required": ["projectChoices"] },
            { "required": ["issueProject"] }
          ]
        }
      }
    }
  ],
  "$defs": {
    "roleModelChoice": {
      "type": "object",
      "additionalProperties": false,
      "required": ["provider", "logicalTier", "reasoningEffort", "speed"],
      "properties": {
        "provider": { "type": "string", "minLength": 1 },
        "logicalTier": {
          "enum": ["project_default", "highest_available"]
        },
        "reasoningEffort": { "const": "high" },
        "speed": { "const": "standard" }
      }
    },
    "reviewerRoleModelChoice": {
      "type": "object",
      "additionalProperties": false,
      "required": [
        "provider",
        "logicalTier",
        "reasoningEffort",
        "speed",
        "independence"
      ],
      "properties": {
        "provider": { "type": "string", "minLength": 1 },
        "logicalTier": {
          "enum": ["project_default", "highest_available"]
        },
        "reasoningEffort": { "const": "high" },
        "speed": { "const": "standard" },
        "independence": {
          "type": "object",
          "additionalProperties": false,
          "required": ["differentFrom"],
          "properties": {
            "differentFrom": { "const": "implementer" }
          }
        }
      }
    },
    "projectChoices": {
      "type": "object",
      "additionalProperties": false,
      "required": [
        "language",
        "testRunner",
        "gherkinDialect",
        "testLayers",
        "forbiddenTestFileSuffixes",
        "naming",
        "packageManager",
        "runtime",
        "ci",
        "release",
        "projectKind",
        "capabilities",
        "quality"
      ],
      "properties": {
        "language": { "type": "string", "minLength": 1 },
        "testRunner": { "type": "string", "minLength": 1 },
        "gherkinDialect": { "type": "string", "minLength": 1 },
        "testLayers": {
          "description": "テスト層の名前。**package側は語彙を定義しない。** 利用側projectが担保の水準を分類する軸として自由に決める。`minItems: 1`を持つのは「テスト層が1つもないprojectはない」ためである。**軸の異なる値を混在させると追跡表の意味が壊れるため、1つの軸で揃える。** 宣言済みの層を取り除くときは、単調性契約により`projectChoiceShrinkProposals`の二段階手順を使う（`schemas/00_利用案内.md`）。**混入した誤りは是正できる。**",
          "type": "array",
          "minItems": 1,
          "uniqueItems": true,
          "items": { "type": "string", "minLength": 1 }
        },
        "forbiddenTestFileSuffixes": {
          "description": "テストファイル名として禁止する接尾辞。**空配列は「この方針を持たない」の正規表現である。**`testLayers`と違い`minItems`を持たないのは、「テスト層が1つもないprojectはない」は成り立つが「禁止接尾辞を持たないprojectはある」ためである。検査系は空配列を禁止対象0件として扱う。既に宣言した値を取り除くときは、単調性契約により`projectChoiceShrinkProposals`の二段階手順を使う（`schemas/00_利用案内.md`）。",
          "type": "array",
          "uniqueItems": true,
          "items": { "type": "string", "pattern": "^\\.[A-Za-z0-9._-]+$" }
        },
        "naming": { "type": "string", "minLength": 1 },
        "packageManager": { "type": "string", "minLength": 1 },
        "runtime": { "type": "string", "minLength": 1 },
        "ci": { "type": "string", "minLength": 1 },
        "modelMapping": {
          "oneOf": [
            { "type": "string", "minLength": 1 },
            {
              "type": "object",
              "additionalProperties": false,
              "required": [
                "roles",
                "fallback",
                "evidenceStoreRoot",
                "retention"
              ],
              "properties": {
                "roles": {
                  "type": "object",
                  "additionalProperties": false,
                  "required": ["coordinator", "implementer", "reviewer"],
                  "properties": {
                    "coordinator": { "$ref": "#/$defs/roleModelChoice" },
                    "implementer": { "$ref": "#/$defs/roleModelChoice" },
                    "reviewer": { "$ref": "#/$defs/reviewerRoleModelChoice" }
                  }
                },
                "fallback": {
                  "type": "object",
                  "additionalProperties": false,
                  "required": ["when", "role", "modelSelection"],
                  "properties": {
                    "when": { "const": "implementer_unavailable" },
                    "role": { "const": "coordinator" },
                    "modelSelection": { "const": "project_default" }
                  }
                },
                "evidenceStoreRoot": {
                  "type": "string",
                  "minLength": 2,
                  "maxLength": 512,
                  "pattern": "^(?!/)(?!\\.\\./)(?!.*\\/\\.\\.\\/)(?!.*\\\\)(?:[A-Za-z0-9._-]+\\/)+$"
                },
                "retention": {
                  "type": "object",
                  "additionalProperties": false,
                  "required": [
                    "retentionDays",
                    "maxRecordsPerIssue",
                    "maxRecordBytes",
                    "rotationCondition",
                    "deletionMethod"
                  ],
                  "properties": {
                    "retentionDays": { "type": "integer", "minimum": 1 },
                    "maxRecordsPerIssue": { "type": "integer", "minimum": 1 },
                    "maxRecordBytes": { "type": "integer", "minimum": 1 },
                    "rotationCondition": { "const": "oldest_first" },
                    "deletionMethod": { "const": "preview_then_explicit" }
                  }
                }
              }
            }
          ]
        },
        "release": { "type": "string", "minLength": 1 },
        "projectKind": { "type": "string", "minLength": 1 },
        "capabilities": {
          "type": "object",
          "additionalProperties": false,
          "required": [
            "privacySecurity",
            "observability",
            "humanCenteredUi",
            "designTokens"
          ],
          "properties": {
            "privacySecurity": { "$ref": "#/$defs/applicability" },
            "observability": { "$ref": "#/$defs/applicability" },
            "humanCenteredUi": { "$ref": "#/$defs/applicability" },
            "designTokens": { "$ref": "#/$defs/applicability" }
          }
        },
        "quality": {
          "type": "object",
          "additionalProperties": false,
          "required": [
            "implementationLanguage",
            "strictTypecheck",
            "forbiddenTypes",
            "lintCommand",
            "formatCheckCommand",
            "formatWriteCommand",
            "typecheckCommand",
            "runtimeValidation",
            "auxiliaryLanguages"
          ],
          "properties": {
            "implementationLanguage": { "type": "string", "minLength": 1 },
            "strictTypecheck": { "const": true },
            "forbiddenTypes": {
              "type": "array",
              "minItems": 1,
              "uniqueItems": true,
              "items": { "type": "string", "minLength": 1 }
            },
            "lintCommand": { "type": "string", "minLength": 1 },
            "formatCheckCommand": { "type": "string", "minLength": 1 },
            "formatWriteCommand": { "type": "string", "minLength": 1 },
            "typecheckCommand": { "type": "string", "minLength": 1 },
            "runtimeValidation": { "type": "string", "minLength": 1 },
            "auxiliaryLanguages": {
              "type": "object",
              "additionalProperties": { "$ref": "#/$defs/applicability" }
            }
          }
        }
      }
    },
    "applicability": {
      "type": "object",
      "additionalProperties": false,
      "required": ["status", "reason", "evidence"],
      "properties": {
        "status": { "enum": ["applicable", "not-applicable"] },
        "reason": { "type": "string", "minLength": 8 },
        "evidence": { "type": "string", "minLength": 4 }
      }
    },
    "rule": {
      "type": "object",
      "additionalProperties": false,
      "required": [
        "ruleId",
        "purpose",
        "riskClass",
        "scope",
        "enforcement",
        "activation",
        "owner",
        "targetLayer",
        "evidence",
        "remediation",
        "overridePolicy",
        "rollback"
      ],
      "properties": {
        "ruleId": { "type": "string", "pattern": "^ASC-[A-Z0-9-]+$" },
        "purpose": { "type": "string", "minLength": 1 },
        "riskClass": { "type": "string", "minLength": 1 },
        "scope": {
          "type": "array",
          "minItems": 1,
          "uniqueItems": true,
          "items": { "type": "string", "minLength": 1 }
        },
        "enforcement": {
          "enum": ["deny", "require", "assist", "warn", "record"]
        },
        "activation": { "enum": ["active", "staged", "disabled"] },
        "owner": { "type": "string", "minLength": 1 },
        "targetLayer": { "enum": ["package", "project", "spec", "evidence"] },
        "evidence": { "type": "string", "minLength": 1 },
        "remediation": { "type": "string", "minLength": 1 },
        "overridePolicy": { "enum": ["never", "bound"] },
        "rollback": { "type": "string", "minLength": 1 }
      },
      "allOf": [
        {
          "if": {
            "properties": { "enforcement": { "const": "deny" } },
            "required": ["enforcement"]
          },
          "then": {
            "properties": {
              "riskClass": {
                "enum": [
                  "secret",
                  "path",
                  "authority",
                  "irreversible",
                  "identity",
                  "artifact"
                ]
              },
              "overridePolicy": { "const": "never" }
            }
          }
        }
      ]
    }
  }
}
